{
  "branch_ref": "synthetic-branch:teaching-only",
  "claim_ceiling": {
    "allowed_claims": [
      "illustrative_interval_arithmetic_only",
      "not_a_real_subject_observation"
    ],
    "basis_refs": [
      "CI_SPECIFICATION.md",
      "CONTINUITY_OBSERVABLES.md",
      "examples/README.md"
    ],
    "prohibited_inferences": [
      "authority_or_permission",
      "biological_age",
      "metaphysical_or_legal_identity",
      "personhood",
      "uninterrupted_existence",
      "wall_clock_age",
      "scientific_validation",
      "r160_qualification"
    ],
    "status": "specified"
  },
  "events": [],
  "irreversible_transitions": [],
  "known_pauses": [
    {
      "classification": "evidenced_unavailable",
      "end": 40,
      "evidence_refs": [
        "evidence:p-one"
      ],
      "pause_id": "p-one",
      "start": 30,
      "uncertainty": [
        "pause_scope_limited"
      ]
    }
  ],
  "lineages": {
    "authority": [],
    "governance": [],
    "memory": [],
    "witness": []
  },
  "observation_window": {
    "end": 60,
    "start": 0
  },
  "profile_id": "profile:ci-teaching-60min",
  "schema_version": "ci-profile-input/v1",
  "subject_ref": "synthetic-subject:teaching-only",
  "time_axis": {
    "basis": "stipulated-teaching-index",
    "origin": "hypothetical-zero",
    "unit": "minute"
  },
  "uncertainty": {
    "authority_uncertainty": [
      "authority_truth_not_attested"
    ],
    "branch_uncertainty": [
      "no_cross_branch_aggregation"
    ],
    "classification_uncertainty": [
      "event_labels_caller_supplied"
    ],
    "clock_uncertainty": [
      "stipulated_minute_ticks_no_physical_clock_measurement"
    ],
    "lineage_uncertainty": [
      "lineages_independently_scoped"
    ],
    "missing_evidence": [
      "outside_observation_window",
      "unobserved_gap_causes"
    ],
    "review_uncertainty": "not_assessed",
    "witness_uncertainty": [
      "witness_independence_not_established"
    ]
  },
  "verified_intervals": [
    {
      "admission_status": "admitted",
      "authority_refs": [
        "authority:bounded"
      ],
      "eligible_for_duration": true,
      "end": 60,
      "evidence_refs": [
        "evidence:i-three:b",
        "evidence:i-three:a"
      ],
      "interval_id": "i-three",
      "participation_predicate": "bounded_test_participation",
      "start": 50,
      "uncertainty": [
        "predicate_scope_limited"
      ],
      "witness_refs": [
        "witness:z",
        "witness:a"
      ]
    },
    {
      "admission_status": "admitted",
      "authority_refs": [
        "authority:bounded"
      ],
      "eligible_for_duration": true,
      "end": 30,
      "evidence_refs": [
        "evidence:i-two:b",
        "evidence:i-two:a"
      ],
      "interval_id": "i-two",
      "participation_predicate": "bounded_test_participation",
      "start": 10,
      "uncertainty": [
        "predicate_scope_limited"
      ],
      "witness_refs": [
        "witness:z",
        "witness:a"
      ]
    },
    {
      "admission_status": "admitted",
      "authority_refs": [
        "authority:bounded"
      ],
      "eligible_for_duration": true,
      "end": 20,
      "evidence_refs": [
        "evidence:i-one:b",
        "evidence:i-one:a"
      ],
      "interval_id": "i-one",
      "participation_predicate": "bounded_test_participation",
      "start": 0,
      "uncertainty": [
        "predicate_scope_limited"
      ],
      "witness_refs": [
        "witness:z",
        "witness:a"
      ]
    }
  ],
  "witnesses": [
    {
      "admission_status": "admitted",
      "authority_ref": "authority:bounded",
      "evidence_refs": [
        "evidence:w-first"
      ],
      "observation_ref": "observation:w-first",
      "time": {
        "lower": 0,
        "upper": 0
      },
      "uncertainty": [
        "synthetic_witness_stipulated_not_observed"
      ],
      "witness_id": "w-first",
      "witness_ref": "witness:w-first"
    },
    {
      "admission_status": "admitted",
      "authority_ref": "authority:bounded",
      "evidence_refs": [
        "evidence:w-last"
      ],
      "observation_ref": "observation:w-last",
      "time": {
        "lower": 60,
        "upper": 60
      },
      "uncertainty": [
        "synthetic_witness_stipulated_not_observed"
      ],
      "witness_id": "w-last",
      "witness_ref": "witness:w-last"
    }
  ]
}
